<?xml version="1.0" encoding="UTF-8"?>

<!-- https://www.w3schools.com/xml/schema_intro.asp -->

<!--<xs:schema xmlns:xs="http://www.w3.org/2001/XMLSchema">-->

<xs:schema xmlns:xs="http://www.w3.org/2001/XMLSchema"
           xmlns="http://github.com/tfreese/arser/config"
           targetNamespace="http://github.com/tfreese/arser/config"
           attributeFormDefault="unqualified"
           elementFormDefault="qualified"
>

    <!--    <import schemaLocation="baseTypes.xsd" namespace="http://baseTypes" />-->

    <xs:element name="arser-settings">
        <xs:annotation>
            <xs:documentation source="description">Configuration for the ARtifact-SERvice.</xs:documentation>
        </xs:annotation>
        <xs:complexType>
            <xs:sequence>
                <xs:element name="workingDir" type="FileUri" />
                <xs:element name="server-setting" type="ServerSetting" />
                <xs:element name="http-client-setting" type="HttpClientSetting" />
                <xs:element name="repositories" type="Repositories" />
                <!--                <xs:element name="db-monitoring" type="DbMonitoringConfig" minOccurs="0" />-->
            </xs:sequence>
        </xs:complexType>
    </xs:element>

    <xs:complexType name="ServerSetting">
        <xs:sequence>
            <xs:element name="port">
                <xs:annotation>
                    <xs:documentation source="description">Port for the Server [1025-65534].</xs:documentation>
                </xs:annotation>
                <xs:simpleType>
                    <xs:restriction base="xs:positiveInteger">
                        <xs:minInclusive value="1025" />
                        <xs:maxInclusive value="65534" />
                    </xs:restriction>
                </xs:simpleType>
            </xs:element>
            <xs:element name="thread-pool-core-size" type="xs:positiveInteger" />
            <xs:element name="thread-pool-max-size" type="xs:positiveInteger" />
            <xs:element name="thread-name-pattern" type="xs:normalizedString" />
        </xs:sequence>
    </xs:complexType>

    <xs:complexType name="HttpClientSetting">
        <xs:sequence>
            <xs:element name="thread-pool-core-size" type="xs:positiveInteger" />
            <xs:element name="thread-pool-max-size" type="xs:positiveInteger" />
            <xs:element name="thread-name-pattern" type="xs:normalizedString" />
        </xs:sequence>
    </xs:complexType>

    <xs:complexType name="StoreSetting">
        <xs:annotation>
            <xs:documentation source="description">Configuration for caching a remote Repository</xs:documentation>
        </xs:annotation>
        <xs:sequence>
            <xs:element name="type">
                <xs:simpleType>
                    <xs:restriction base="xs:normalizedString">
                        <xs:enumeration value="file" />
                        <xs:enumeration value="jdbc" />
                    </xs:restriction>
                </xs:simpleType>
            </xs:element>
            <xs:element name="uri">
                <xs:simpleType>
                    <xs:restriction base="xs:anyURI">
                        <xs:minLength value="10" />
                    </xs:restriction>
                </xs:simpleType>
            </xs:element>
            <xs:element name="driverClassName" type="xs:normalizedString" minOccurs="0" />
            <xs:element name="user" type="xs:normalizedString" minOccurs="0" />
            <xs:element name="password" type="xs:normalizedString" minOccurs="0" />
            <xs:element name="pool-core-size" type="xs:positiveInteger" minOccurs="0" />
            <xs:element name="pool-max-size" type="xs:positiveInteger" minOccurs="0" />
        </xs:sequence>
    </xs:complexType>

    <xs:simpleType name="FileUri">
        <xs:annotation>
            <xs:documentation source="description">file://*</xs:documentation>
        </xs:annotation>
        <xs:restriction base="xs:anyURI">
            <xs:minLength value="10" />
            <xs:pattern value="file://.*" />
        </xs:restriction>
    </xs:simpleType>

    <xs:simpleType name="WebUri">
        <xs:annotation>
            <xs:documentation source="description">https://*, http://*</xs:documentation>
        </xs:annotation>
        <xs:restriction base="xs:anyURI">
            <xs:minLength value="10" />
            <xs:pattern value="https://.*" />
            <xs:pattern value="http://.*" />
        </xs:restriction>
    </xs:simpleType>

    <xs:simpleType name="ContextRoot">
        <xs:annotation>
            <xs:documentation source="description">ContextRoot of a Repository</xs:documentation>
        </xs:annotation>
        <xs:restriction base="xs:normalizedString">
            <xs:minLength value="5" />
            <xs:pattern value="([a-z0-9\-_])+" />
        </xs:restriction>
    </xs:simpleType>

    <xs:complexType name="FileRepoSetting">
        <xs:annotation>
            <xs:documentation source="description">File Repository [file://*].</xs:documentation>
        </xs:annotation>
        <xs:sequence>
            <xs:element name="contextRoot" type="ContextRoot" />
            <xs:element name="path" type="FileUri" />
        </xs:sequence>
        <!-- <xs:attribute name="writeable" type="xs:boolean" default="false"> -->
        <xs:attribute name="writeable" type="xs:boolean" use="required">
            <xs:annotation>
                <xs:documentation source="description">Use the Repository für deployments.</xs:documentation>
            </xs:annotation>
        </xs:attribute>
    </xs:complexType>

    <xs:complexType name="RemoteRepoSetting">
        <xs:annotation>
            <xs:documentation source="description">Remote Repository [https://*,http://*].</xs:documentation>
        </xs:annotation>
        <xs:sequence>
            <xs:element name="contextRoot" type="ContextRoot" />
            <xs:element name="uri" type="WebUri" />
            <xs:element name="storeSetting" type="StoreSetting" minOccurs="0" />
        </xs:sequence>
    </xs:complexType>

    <xs:complexType name="VirtualRepoSetting">
        <xs:annotation>
            <xs:documentation source="description">
                Virtual Repository as mirror [https://HOST:PORT/NAME]
                Processed in declarative order.
            </xs:documentation>
        </xs:annotation>
        <xs:sequence>
            <xs:element name="contextRoot" type="ContextRoot" />
            <xs:element name="repository-ref" type="xs:normalizedString" maxOccurs="unbounded" />
        </xs:sequence>
    </xs:complexType>

    <xs:complexType name="Repositories">
        <xs:annotation>
            <xs:documentation source="description">Repository Declaration.</xs:documentation>
        </xs:annotation>
        <xs:sequence>
            <xs:element name="remote" type="RemoteRepoSetting" maxOccurs="unbounded" />
            <xs:element name="file" type="FileRepoSetting" minOccurs="0" maxOccurs="unbounded" />
            <xs:element name="virtual" type="VirtualRepoSetting" maxOccurs="unbounded" />
        </xs:sequence>
    </xs:complexType>

    <!--    <xs:complexType name="DbMonitoringConfig">-->
    <!--        <xs:annotation>-->
    <!--            <xs:documentation source="description">DB-Monitoring for the Server.</xs:documentation>-->
    <!--        </xs:annotation>-->
    <!--        <xs:sequence>-->
    <!--            <xs:element name="jdbc-url">-->
    <!--                <xs:simpleType>-->
    <!--                    <xs:restriction base="xs:normalizedString">-->
    <!--                        <xs:minLength value="10" />-->
    <!--                        <xs:pattern value="jdbc:.*" />-->
    <!--                    </xs:restriction>-->
    <!--                </xs:simpleType>-->
    <!--            </xs:element>-->
    <!--        </xs:sequence>-->
    <!--        <xs:attribute name="enabled" type="xs:boolean" use="required">-->
    <!--            <xs:annotation>-->
    <!--                <xs:documentation source="description">Enable/Disable this service.</xs:documentation>-->
    <!--            </xs:annotation>-->
    <!--        </xs:attribute>-->
    <!--    </xs:complexType>-->

    <!--    <xs:simpleType name="RepositoryUri">-->
    <!--        <xs:annotation>-->
    <!--            <xs:documentation source="description">file://*, http://*, https://*</xs:documentation>-->
    <!--        </xs:annotation>-->
    <!--        &lt;!&ndash;        <xs:restriction base="xs:anyURI">&ndash;&gt;-->
    <!--        &lt;!&ndash;            <xs:pattern value="file://.*" />&ndash;&gt;-->
    <!--        &lt;!&ndash;            <xs:pattern value="http://.*" />&ndash;&gt;-->
    <!--        &lt;!&ndash;            <xs:pattern value="https://.*" />&ndash;&gt;-->
    <!--        &lt;!&ndash;        </xs:restriction>&ndash;&gt;-->
    <!--        <xs:union memberTypes="FileUri">-->
    <!--            <xs:simpleType>-->
    <!--                <xs:restriction base="xs:anyURI">-->
    <!--                    <xs:minLength value="10"/>-->
    <!--                    <xs:pattern value="http://.*"/>-->
    <!--                    <xs:pattern value="https://.*"/>-->
    <!--                </xs:restriction>-->
    <!--            </xs:simpleType>-->
    <!--        </xs:union>-->
    <!--    </xs:simpleType>-->

</xs:schema>
