<?xml version="1.0" encoding="UTF-8"?>

<!-- https://www.w3schools.com/xml/schema_intro.asp -->

<!--<proxy-config xmlns:xsi="http://www.w3.org/2001/XMLSchema-instance" xsi:noNamespaceSchemaLocation="arser-config.xsd">-->
<!-- xsi:schemaLocation="http://github.com/tfreese/arser/config https://raw.githubusercontent.com/tfreese/arser/master/configuration/src/main/resources/xsd/arser-config.xsd" -->
<arser-settings xmlns:xsi="http://www.w3.org/2001/XMLSchema-instance" xmlns="http://github.com/tfreese/arser/config"
                xsi:schemaLocation="http://github.com/tfreese/arser/config https://raw.githubusercontent.com/tfreese/arser/master/configuration/src/main/resources/xsd/arser-config.xsd">

    <workingDir>file:///opt/jvmapps/arser</workingDir>

    <server-setting>
        <port>7999</port>
        <thread-pool-core-size>2</thread-pool-core-size>
        <thread-pool-max-size>6</thread-pool-max-size>
        <thread-name-pattern>http-server-%d</thread-name-pattern>
    </server-setting>

    <http-client-setting>
        <thread-pool-core-size>2</thread-pool-core-size>
        <thread-pool-max-size>6</thread-pool-max-size>
        <thread-name-pattern>http-client-%d</thread-name-pattern>
    </http-client-setting>

    <repositories>
        <remote>
            <contextRoot>maven-central</contextRoot>
            <uri>https://repo1.maven.org/maven2</uri>
        </remote>
        <remote>
            <contextRoot>spring-release</contextRoot>
            <uri>https://repo.spring.io/release</uri>
        </remote>
        <remote>
            <contextRoot>primefaces</contextRoot>
            <uri>https://repository.primefaces.org</uri>
            <storeSetting>
                <type>file</type>
                <uri>file:///opt/jvmapps/arser/cache/primefaces</uri>
            </storeSetting>
        </remote>
        <remote>
            <contextRoot>gradle-releases</contextRoot>
            <uri>https://repo.gradle.org/gradle/libs-releases</uri>
            <storeSetting>
                <type>jdbc</type>
                <uri>jdbc:hsqldb:file:/opt/jvmapps/arser/database/gradle-releases/gradle-releases;shutdown=true</uri>
                <driverClassName>org.hsqldb.jdbc.JDBCDriver</driverClassName>
                <user>sa</user>
                <password />
                <pool-core-size>2</pool-core-size>
                <pool-max-size>6</pool-max-size>
            </storeSetting>
        </remote>
        <remote>
            <contextRoot>gradle-plugins</contextRoot>
            <uri>https://plugins.gradle.org</uri>
        </remote>
        <local writeable="true">
            <contextRoot>third-party</contextRoot>
            <path>file:///home/tommy/.m2/third-party</path>
        </local>
        <local writeable="true">
            <contextRoot>deploy-releases</contextRoot>
            <path>file:///opt/jvmapps/arser/work/deploy-releases</path>
        </local>
        <local writeable="true">
            <contextRoot>deploy-snapshots</contextRoot>
            <path>file:///opt/jvmapps/arser/work/deploy-snapshots</path>
        </local>
        <local writeable="true">
            <contextRoot>deploy-sites</contextRoot>
            <path>file:///opt/jvmapps/arser/work/deploy-sites</path>
        </local>
        <virtual>
            <contextRoot>public</contextRoot>
            <repository-ref>maven-central</repository-ref>
            <repository-ref>spring-releases</repository-ref>
            <repository-ref>primefaces</repository-ref>
            <repository-ref>gradle-releases</repository-ref>
            <repository-ref>gradle-plugins</repository-ref>
        </virtual>
        <virtual>
            <contextRoot>public-local</contextRoot>
            <repository-ref>third-party</repository-ref>
            <repository-ref>deploy-releases</repository-ref>
            <repository-ref>deploy-snapshots</repository-ref>
        </virtual>
    </repositories>

</arser-settings>
